TipType	TipTemplateId	Notice	zh_CN	en_US	de_DE	es_ES	pt_BR	vi_VN	ru_RU	ko_KR	fr_FR	it_IT	in_ID	th_TH	tr_TR	ja_JP	pl_PL
枚举类型	模板说明	备注	中文	英文	德语	西语	葡萄牙语	越南语	俄语	韩语	法语	意大利语	印尼语	泰语	土耳其	日语	波兰
1049001	GameName	游戏名称	空岛生存矿区	SkyBlock	SkyBlockMiningArea	SkyBlockMiningArea	SkyBlockMiningArea	SkyBlockMiningArea	SkyBlockMiningArea	SkyBlockMiningArea	SkyBlockMiningArea	SkyBlockMiningArea	SkyBlockMiningArea	SkyBlockMiningArea	SkyBlockMiningArea	SkyBlockMiningArea	SkyBlockMiningArea
1049002	msgCannotBackHome	PVP区域禁止回家	▢FFFF0000PVP区域禁止回家	▢FFFF0000Can't go home at PVP area	▢FFFF0000Kann nicht im PVP-Bereich nach Hause gehen	▢FFFF0000 No puedo ir a casa en el área PVP	▢FFFF0000Não pode ir para casa na área de PVP	FFFF0000Không thể về nhà tại khu vực PVP	▢FFFF0000Не могу пойти домой в районе PVP	▢FFFF0000PVP 지역에서 집에 갈 수 없습니다	▢FFFF0000Je ne peux pas rentrer chez moi dans la zone PVP	▢FFFF0000Non posso tornare a casa nell'area PVP	▢FFFF0000Tidak bisa pulang ke rumah di area PVT	▢FFFF0000ไม่สามารถกลับบ้านที่พื้นที่ PVP	▢FFFF0000PVP alanında eve gidemiyorum	▢FFFF0000PVPエリアに帰れない	▢FFFF0000Nie mogę wrócić do domu w strefie PVP
1049003	msgRefreshMapCountDown	地图将在几秒后刷新	▢FFFF0000地图将在▢FF00FF00%1s▢FFFF0000秒后刷新	▢FFFF0000Mine Cave will refresh in ▢FF00FF00%1s ▢FFFF0000seconds	▢FFFF0000Meine Höhle wird in %1s Sekunden aktualisiert	▢FFFF0000 La cueva de la mina se actualizará en %1s segundos	▢FFFF0000A caverna de minas será atualizada em %1s segundos	FFFF0000Hang động của tôi sẽ làm mới trong %1s giây	▢FFFF0000Моя пещера освежится в ▢FF00FF00%1s ▢FFFF0000секунд	▢FFFF0000광산 동굴이 새로 고침됩니다. ▢FF00FF00%1s ▢FFFF0000초	▢FFFF0000Mine Cave va rafraîchir dans ▢FF00FF00%1s ▢FFFF0000seconds	▢FFFF0000La mia grotta si rinfrescerà ▢FF00FF00%1s ▢FFFF0000secondi	▢FFFF0000Gua Tambang akan disegarkan ▢FF00FF00%1s ▢FFFF0000detik	▢FFFF0000ถ้ำฉัน จะรีเฟรช ▢FF00FF00%1s ▢FFFF0000วินาที	▢FFFF0000Mayın Mağarası yenilenecek ▢FF00FF00%1s ▢FFFF0000saniye	▢FFFF0000鉱山の洞窟が更新されます ▢FF00FF00%1s ▢FFFF0000秒	▢FFFF0000Moja Jaskinia się odświeży ▢FF00FF00%1s ▢FFFF0000sekundy
1049004	msgGetGemSuccess	恭喜玩家抢得宝石	▢FFFF0000恭喜玩家▢FF00FF00%1s▢FFFF0000抢得宝石	▢FFFF0000Congratulations to the player ▢FF00FF00%1s▢FFFF0000 win the gem			▢FFFF0000Parabéns ao jogador ▢FF00FF00%1s▢FFFF0000 ganhar o gme	▢FFFF0000Chúc mừng người chơi ▢FF00FF00%1s▢FFFF0000 thắng trò chơi 									
1049005	msgTransmitting	传送中，请等待!	▢FFFF0000传送中，请等待!	▢FFFF0000 is being teleported, please wait!			▢FFFF0000 está sendo teleportado, aguarde!	▢FFFF0000 đang được dịch chuyển tức thời, xin vui lòng chờ!	▢FFFF0000 телепортируется, подождите, пожалуйста.								
1049006	msgUIButtonCountDown	距离下一次可操作还剩%1s秒	▢FFFF0000距离下一次可操作还剩▢FF00FF00%1s▢FFFF0000秒	▢FFFF0000Need to wait %1s seconds to do the next operation	▢FFFF0000Warten Sie %1s Sekunden, um den nächsten Vorgang auszuführen	▢FFFF0000 Necesita esperar %1s segundos para hacer la próxima operación	▢FFFF0000Precisa esperar %1s segundos para fazer a próxima operação	▢FFFF0000 Cần đợi %1s giây giây  để thực hiện thao tác tiếp theo	▢FFFF0000Нужно подождать %1s секунд, чтобы сделать следующую операцию	▢FFFF0000기다릴 필요가있다 %1s 다음 작업을 수행하는 초	▢FFFF0000Besoin d'attendre %1s secondes pour faire la prochaine opération	▢FFFF0000Ho bisogno di aspettare %1s secondi per eseguire l'operazione successiva	▢FFFF0000Perlu menunggu %1s detik untuk melakukan operasi selanjutnya	▢FFFF0000ต้องรอ %1s วินาทีในการดำเนินการต่อไป	▢FFFF0000Beklemeniz gerek %1s sonraki işlemi yapmak için saniyeler	▢FFFF0000待つ必要があります %1s 次の操作を行う秒	▢FFFF0000Potrzeba czekania %1s sekund, aby wykonać następną operację
